id,uri,file,inception,title_en,title_es,label_en,label_es,caption
Q5766842,http://www.wikidata.org/entity/Q5766842,Q5766842.jpg,1799,,Chitón,Chitón,,"The image is a black-and-white drawing of a man and a woman. The man is holding a sword in his right hand and appears to be in a defensive stance. He has curly hair and is wearing a long-sleeved shirt and pants. The woman is standing to the right of the man. She has long hair and is also wearing a long-sleeved shirt and pants. Her hair is tied back, and she is wearing a headscarf. The background consists of a landscape with trees and a cloudy sky. There is text at the bottom of the image that reads ""Chiton.""

### Analysis and Description:
1. **Subjects**: The image features a man and a woman.
2. **Attire**: The man is wearing a long-sleeved shirt and pants, while the woman is wearing a long-sleeved shirt and pants with a headscarf.
3. **Action**: The man is holding a"
Q5783623,http://www.wikidata.org/entity/Q5783623,Q5783623.jpg,1763,,,Consecration of Aloysius Gonzaga as patron saint of youth,,"The image appears to be a painting or drawing depicting a religious scene. The central figure in the image is a man dressed in a long, flowing robe, holding a staff in his left hand and pointing upwards with his right hand. He has a halo around his head and is surrounded by clouds, suggesting a divine or heavenly presence.

Surrounding the central figure are several other figures, some of whom appear to be angels or heavenly beings. These figures are depicted in various poses and gestures, some of them reaching out towards the central figure, while others seem to be interacting with the central figure.

In the background, there is a large, ornate building with columns and arches. The building appears to be a church or a place of worship, as indicated by the architectural style and the presence of stained glass windows.

The painting is done in a realistic style, with attention to detail in the clothing, facial expressions, and body language of the figures. The colors used in the"
Q5791722,http://www.wikidata.org/entity/Q5791722,Q5791722.jpg,1819,,,Christ on the Mount of Olives,,"The image depicts a scene from a painting or drawing. In the foreground, there is a figure dressed in long, flowing robes. The figure appears to be a man, with long hair and a beard. He is standing with his arms outstretched, as if he is reaching out towards something or someone. His posture suggests a sense of movement and purpose.

In the background, there is another figure, also dressed in long robes. This person seems to be seated on a raised platform or ledge. They appear to be enjoying a meal, as indicated by the presence of a plate in their hands. The plate is filled with food, suggesting that they might be enjoying a meal together.

The background of the image is dark, with a strong contrast between the light and dark areas. This creates a dramatic effect, drawing the viewer's attention to the figures in the foreground. The dark background helps to emphasize the figures and their actions, making them the focal point of the image."
Q5795925,http://www.wikidata.org/entity/Q5795925,Q5795925.jpg,1786,Boy on a Ram,El niño del carnero.,Boy on a Ram,,"The painting depicts a young woman seated on a rocky hilltop, holding a whip in her right hand. She is wearing a wide-brimmed hat with a red ribbon and a white blouse. The woman's face is not clearly visible, but she appears to be focused on the task at hand. She is holding the whip in her right hand, which is raised above her head, suggesting she is attempting to control or guide the goat she is riding.

The goat is standing on its hind legs, with its front legs in the air. The goat has a brown coat and is wearing a bell around its neck. The background of the painting is dominated by a sky filled with clouds. The sky is painted in various shades of blue and white, creating a sense of depth and atmosphere. In the distance, there are faint outlines of hills and trees, suggesting a natural landscape.

The painting is done in a realistic style, with attention to detail in the depiction of the woman"
Q5796865,http://www.wikidata.org/entity/Q5796865,Q5796865.jpg,1793,,Cómicos ambulantes,The Strolling Players,,"The painting depicts a lively scene with several individuals engaged in various activities. In the foreground, on the left side of the image, there is a person dressed in what appears to be a military uniform. This individual seems to be in motion, possibly engaged in some form of physical activity, such as running or jumping.

To the right of the person in the military uniform, there is a young child dressed in what seems to be a colonial-era outfit. The child is barefoot and appears to be in motion, possibly running or leaping.

In the center of the image, there is a woman dressed in a traditional colonial-era outfit. She is holding a small object, possibly a doll or a toy, and seems to be interacting with the child in the foreground.

In the background, there is a landscape with rolling hills and a body of water, suggesting a rural or semi-rural setting. The sky above is cloudy, indicating a potentially overcast day."
Q5804354,http://www.wikidata.org/entity/Q5804354,Q5804354.jpg,1799,,"Despacha, que dispiertan","Despacha, que dispiertan",,"The image is a black-and-white drawing or painting depicting three figures seated at a table. The central figure appears to be a woman with long hair, wearing a long dress and a hat. She is holding a long stick, possibly a spear, in her right hand, and her left hand is resting on the table. The other two figures appear to be men, one of whom is seated on the left side of the table and the other on the right side. The man seated on the left side of the table is wearing a long robe, while the man seated on the right side is wearing a hat and a long robe. The background of the image is plain, with no additional details or objects visible.

The drawing is done in a realistic style, with fine lines and shading used to create depth and texture. The figures are depicted in a way that suggests they are engaged in a moment of contemplation or discussion, as indicated by their postures and the objects they are holding. The"
Q5804778,http://www.wikidata.org/entity/Q5804778,Q5804778.jpg,1799,,Devota profesion,Devota profesion,,"The image is a black-and-white drawing or painting. The central figure is a naked man lying on a bed. He appears to be in a state of distress, with his eyes closed and his face contorted in pain or agony. He is surrounded by other figures, two of whom are seated on either side of him. One of these seated figures appears to be a woman, while the other is a man. The woman is holding a book in her hands, suggesting that she might be reading or explaining something to the man.

The background of the image is plain and unadorned, focusing the viewer's attention on the central figures. There are no other objects or details in the background, which helps to keep the viewer's focus on the central subjects.

The text at the bottom of the image reads ""Devota Profession,"" which translates to ""Devota Profession"" in English. This indicates that the image is likely depicting a religious or spiritual context"
Q5807649,http://www.wikidata.org/entity/Q5807649,Q5807649.jpg,1799,,Dios la perdone. Y era su madre,Dios la perdone. Y era su madre,,"The image is a black-and-white drawing or painting of two women. The women are depicted standing side by side, facing slightly towards each other. The woman on the left is holding a rectangular object in her hands, which appears to be a piece of fabric or a hat. The woman on the right is holding a similar object in her hands. Both women are dressed in long, loose-fitting garments. The woman on the left is wearing a dark-colored garment with a hood, while the woman on the right is wearing a light-colored garment with a hood.

The background of the image is blurred, but it appears to be an outdoor scene, possibly a landscape or a natural setting. There are no other objects or figures in the background, which helps to keep the focus on the two women.

The text at the bottom of the image reads ""Dios la perdona. Yera su madre,"" which translates to ""God be with you. Mother"
Q5823782,http://www.wikidata.org/entity/Q5823782,Q5823782.jpg,1786,,,El albañil borracho (boceto),,"The image depicts a scene from what appears to be an outdoor setting, possibly a circus or a circus-like venue. In the foreground, there are three individuals engaged in what seems to be a playful or celebratory activity. 

The individual on the left is wearing a light-colored shirt and dark pants. They have short hair and are smiling, appearing to be enjoying themselves. The individual in the middle is wearing a dark-colored outfit, possibly a t-shirt and pants, and is also smiling. This person is holding the third individual, who is standing on the ground. The third individual is wearing a dark-colored outfit and has short hair. They are also smiling and appear to be enjoying themselves.

In the background, there is a structure that resembles a fence or railing. The structure is made of metal and appears to be part of a circus or circus-like venue. The sky in the background is partly cloudy with patches of blue visible, suggesting it might be"
Q5823784,http://www.wikidata.org/entity/Q5823784,Q5823784.jpg,1786,,,The wounded bricklayer,,"The painting or drawing depicts a scene with three figures. The central figure appears to be a man dressed in dark clothing, possibly a military uniform, with a white cravat around his neck. He is seated on an elevated surface, possibly a platform or a raised platform, with one leg bent at the knee and the other bent at the elbow, supporting his weight. The man's face is not clearly visible, but his posture suggests he is in a relaxed state.

To the left of the central figure, there is another man dressed in light-colored clothing. He is also seated on an elevated surface, but his posture is different from that of the central figure. He appears to be in a more upright position, with one leg bent at the knee and the other bent at the elbow, supporting his weight. His facial expression is not clearly visible, but his posture suggests he is also in a relaxed state.

To the right of the central figure, there is another man dressed in"
Q5823870,http://www.wikidata.org/entity/Q5823870,Q5823870.jpg,1799,,El amor y la muerte,El amor y la muerte,,"The image is a black-and-white drawing or painting. The primary subject of the image is a man and a woman who appear to be embracing each other. The man is positioned on the right side of the image, with his arms wrapped around the woman. The woman is positioned on the left side of the image, with her arms around the man's waist. Both individuals are dressed in casual clothing, suggesting a moment of intimacy and affection.

The background of the image consists of a plain, light-colored surface, possibly a wall or a floor. There are no additional objects or elements in the background, keeping the focus solely on the two figures in the foreground.

At the bottom of the image, there is text that reads ""El hombre y la mujer,"" which translates to ""The Man and the Woman"" in English. This text is written in a serif font and is centered at the bottom of the image.

### Analysis and Description"
Q5824333,http://www.wikidata.org/entity/Q5824333,Q5824333.jpg,1778,,,The blind guitarist,,"The painting depicts a group of people in an outdoor setting. In the foreground, there is a man lying on the ground, possibly injured or deceased. He is dressed in a light-colored shirt and dark pants. To the right of the man, there is a woman wearing a light-colored dress and a hat. She appears to be comforting the injured man.

In the middle ground, there is a group of people, including men, women, and children. They are dressed in various types of clothing, suggesting a variety of social classes. Some of the individuals are carrying umbrellas, indicating that it might be raining or that the weather is cool.

In the background, there is a large tree with green leaves, and behind it, there is a building with a steep roof. The sky above is partly cloudy, with patches of blue visible through the clouds.

The painting is done in a realistic style, with attention to detail in the clothing, expressions,"
Q5824419,http://www.wikidata.org/entity/Q5824419,Q5824419.jpg,1787,,,The swing (1787),,"The painting depicts an outdoor scene with several figures engaged in what appears to be a hunting or fishing activity. In the foreground, there are two men and a woman. The man on the left is holding a bow and arrow, while the man on the right is holding a spear. They appear to be in motion, suggesting they are in the midst of a hunt or fishing expedition.

In the background, there is a large tree with a broken branch extending towards the sky. The sky is partly cloudy, with patches of blue visible through the gaps in the clouds. There are also other trees and foliage in the background, indicating a natural setting.

To the left side of the image, there is a woman seated on the ground. She appears to be wearing a long dress, and her hair is tied back. She seems to be watching the activity taking place in the foreground.

To the right side of the image, there is a man lying on the ground. He appears to"
Q5824421,http://www.wikidata.org/entity/Q5824421,Q5824421.jpg,1779,,,The Swing,,"The painting depicts a group of people engaged in outdoor activities. In the foreground, there is a woman seated on a rock, wearing a light-colored dress with a white collar. She appears to be in conversation with a young child, who is also seated on the rock. The child is dressed in a light-colored shirt and pants. To the left of the seated woman, there is another child, also dressed in a light-colored shirt and pants.

In the background, there is a large tree with a thick trunk and branches extending towards the sky. Behind the tree, there is a landscape with rolling hills and what appears to be a small village or town. The sky above is partly cloudy, with patches of blue visible through the clouds.

The painting is done in a realistic style, with attention to detail in the clothing, facial expressions, and expressions of the people. The colors used are muted and earthy, giving the scene a warm and natural feel."
Q5824594,http://www.wikidata.org/entity/Q5824594,Q5824594.jpg,1799,,El de la Rollona,El de la Rollona,,"The image is a black-and-white drawing or painting. The central figure in the image is a woman who appears to be in a state of contemplation or contemplation. She is dressed in a long, light-colored dress with intricate patterns and has a crown on her head. Her expression is serious, and she seems to be engaged in a moment of thought or deep reflection.

To the right of the woman, there is a person who appears to be a man. He is also dressed in a long, light-colored garment, similar to the one worn by the woman. The man's face is not clearly visible, but he seems to be focused on something in front of him.

In the background, there are some objects that appear to be part of a larger setting, possibly a room or an interior space. These objects include a table with some items on it, such as what looks like a book or a bowl. The background is dark, which contrasts with the lighter"
Q5825437,http://www.wikidata.org/entity/Q5825437,Q5825437.jpg,1779,,El juego de la pelota a pala,The game of pelota with rackets,,"The painting depicts a large group of people gathered in what appears to be a historical or archaeological site. In the foreground, there are several individuals who appear to be engaged in various activities. Some are standing, some are kneeling, and some are lying down. One person is kneeling on the ground and appears to be holding something, possibly a cloth or a piece of clothing. 

In the background, there is a large stone structure, which could be a monument or a historical building. The structure has a flat top and appears to be made of large blocks of stone. Behind the structure, there are trees and hills, suggesting a natural setting. The sky above is partly cloudy, indicating that it might be a sunny day.

The people in the painting are dressed in period clothing, which suggests that the scene is set in a historical period, likely the 18th or 19th century given the style of clothing. The people are engaged in various activities, such as"
Q5825624,http://www.wikidata.org/entity/Q5825624,Q5825624.jpg,1779,,El majo de la guitarra.,Majo with a Guitar,,"The painting depicts a man seated on a rocky outcrop. He is wearing a light blue shirt and yellow knee-length shorts. His right leg is crossed over his left, and he is holding a guitar in his right hand. His left hand rests on his knee, and he has a focused expression on his face.

In the background, there are two other figures. One of them is partially visible and appears to be a woman. She is wearing a hat and has long, dark hair. The other figure is also partially visible and seems to be a man. He is wearing a hat and has short, dark hair.

The painting is done in a realistic style, with attention to detail in the clothing and the expressions of the figures. The colors used are muted and earthy, giving the scene a warm, earthy feel. The background is dark, which helps to focus the viewer's attention on the figures in the foreground.

The overall mood of the painting is one"
Q5825747,http://www.wikidata.org/entity/Q5825747,Q5825747.jpg,1779,,El militar y la señora,The soldier and the lady,,"The image depicts a scene from a historical or classical painting, likely from the 18th or 19th century, given its style and subject matter. The primary focus of the painting is a group of people engaged in what appears to be a moment of interaction or celebration.

### Objects Present in the Painting:

1. **Foreground**: In the foreground of the painting, there are several individuals. On the left side of the image, there is a woman dressed in a black dress with a white collar. She has long blonde hair and is facing towards the right side of the image. To her right, there is a man dressed in a black coat with a white shirt and a black hat. He is also facing towards the right side of the image.

2. **Middle Ground**: In the middle ground of the image, there are two men. One man is dressed in a white shirt and black trousers, while the other man is dressed in a black coat"
Q5825829,http://www.wikidata.org/entity/Q5825829,Q5825829.jpg,1779,,El muchacho del pájaro,the Boy with a bird,,"The painting or drawing depicts an outdoor scene with a large tree in the background. The tree has a thick trunk and several branches with green leaves. There is a bird perched on one of the branches near the top of the tree. Below the tree, there is a person wearing a red and white striped shirt. The person appears to be holding a small object, possibly a bird, in their hand. In the foreground, there is a small body of water, possibly a pond or lake, with a few ripples on its surface. The sky above the tree is a gradient of blue, transitioning from light blue at the top to a darker blue near the horizon."
Q5825884,http://www.wikidata.org/entity/Q5825884,Q5825884.jpg,1780,El Médico (The Doctor),,El Médico,,"The painting depicts a scene from a historical period, likely the Renaissance or Baroque era, given the style and subject matter. The central figure is a man dressed in an elaborate red robe with gold trim, which is characteristic of Renaissance attire. He is holding a tall, thin staff in his left hand and appears to be gesturing or gesturing with his right hand. The man is standing on what appears to be a wooden table, which is cluttered with various objects, including a large bowl filled with food.

To the left of the man, there is a shovel resting on the table, suggesting that the man might be engaged in some form of agricultural work. Behind the man, there is a young boy dressed in a black hat and a long red robe. The boy seems to be looking at the man with a curious expression.

In the background, there is a tree with bare branches, indicating that the season might be late autumn or early winter. The sky above is dark,"
Q5825919,http://www.wikidata.org/entity/Q5825919,Q5825919.jpg,1779,,El niño del árbol.,The tree boy,,"The image depicts a scene from a painting or drawing that appears to be set outdoors. The focal point of the image is a person lying face down on the ground. The person is dressed in dark clothing, including a long-sleeved shirt and pants, and appears to be in a state of distress or exhaustion. The person's arms are outstretched, and their head is tilted to the side, suggesting they may be in a state of pain or distress.

In the background, there is a tree with branches extending towards the sky. The tree has green leaves and appears to be in a natural setting, possibly a forest or a wooded area. The sky above the tree is light blue with patches of white clouds, indicating fair weather.

The painting or drawing is done in a realistic style, with attention to detail in the depiction of the person, the tree, and the surrounding environment. The colors used are muted, with a focus on earthy tones such as browns"
Q5826221,http://www.wikidata.org/entity/Q5826221,Q5826221.jpg,1798,,,The arrest of Christ,,"The painting depicts a group of people in what appears to be a dimly lit indoor setting. The individuals are dressed in period-appropriate clothing, which suggests that the scene is set in a historical or fantasy context. The people are arranged in a semi-circular formation, with some standing and others seated. 

In the foreground, there is a woman who appears to be the focal point of the group. She is dressed in a long, flowing gown that seems to be made of fabric, possibly silk or a similar material. Her hair is long and dark, and she has a serene expression on her face. She is holding a small object in her right hand, which could be a book or a similar item.

To the left of the woman, there is another person who is also dressed in a long, flowing gown. This individual appears to be engaged in conversation with the woman in the foreground. They seem to be listening attentively to what the woman is saying."
Q5826428,http://www.wikidata.org/entity/Q5826428,Q5826428.jpg,1779,,El resguardo de tabacos,the tobacco guards,,"The painting depicts a group of people seated on a rocky outcrop in what appears to be a scenic landscape. The central figure is a man dressed in military attire, characterized by a high-collared coat, knee-high boots, and a hat with a wide brim. He is holding a rifle in his right hand, and his posture suggests readiness for action.

To the left of the central figure, there is another individual who appears to be engaged in conversation. This person is also dressed in military attire, with a similar high-collared coat, knee-high boots, and a hat with a wide brim. They seem to be listening attentively to the central figure.

To the right of the central figure, there are two additional individuals seated on the rocky outcrop. These individuals appear to be engaged in conversation, with one of them holding a rifle in their right hand. They are dressed similarly to the central figure, with high-collared coats, knee-high boots"
Q5826777,http://www.wikidata.org/entity/Q5826777,Q5826777.jpg,1799,,El sí pronuncian y la mano alargan al primero que llega,El sí pronuncian y la mano alargan al primero que llega,,"The image appears to be a black-and-white drawing or painting. The central figure in the image is a woman standing in the foreground. She is wearing a long, white dress and has a serious expression on her face. Her hair is pulled back into a bun, and she is looking slightly to her right. 

To the left of the woman, there is a man dressed in a dark-colored suit. He is also wearing a hat and has a stern expression on his face. He seems to be engaged in conversation with the woman. 

To the right of the woman, there is another man dressed in a dark-colored suit. He is also wearing a hat and has a serious expression on his face. He seems to be engaged in conversation with the woman. 

In the background, there is a group of people gathered around a table. The table is covered with what appears to be a tablecloth, and there are several people seated at the table. The people"
Q5827041,http://www.wikidata.org/entity/Q5827041,Q5827041.jpg,1799,,El vergonzoso,El vergonzoso,,"The image appears to be a black and white drawing or painting. In the foreground, there is a person seated on the ground. This person is wearing a long garment that covers their entire body, including their head. The person's face is not clearly visible, but they appear to be in a state of distress or discomfort.

In the background, there are two other figures. One of the figures is seated and appears to be in a state of distress or exhaustion. The other figure is standing and appears to be engaged in some activity, possibly reading or writing.

There is text at the bottom of the image. The text is written in a cursive style and appears to be the name ""Vergonzon.""

The background of the image is plain and nondescript, with no other details or objects visible.

Based on the description, it can be inferred that the image depicts a moment of distress or exhaustion, possibly due to a physical or emotional challenge. The"
