id,uri,file,inception,title_en,title_es,label_en,label_es,caption
Q18601009,http://www.wikidata.org/entity/Q18601009,Q18601009.jpg,1808,Poetry and Poets,,Poetry and Poets,,"The painting or drawing depicts a scene from the Garden of Gethsemane. In the foreground, there is a woman seated on a rock. She is dressed in a blue and white gown and has a crown on her head. She appears to be in a state of contemplation or prayer, with her hands clasped in front of her.

In the background, there is a group of figures, some of whom appear to be angels or heavenly beings. They are gathered around the woman, some of whom are kneeling or sitting on the rocks. These figures seem to be in a state of awe or reverence, as they are looking up at the woman.

The sky in the background is cloudy, with shades of blue and gray. There are no visible clouds in the sky, suggesting that it might be either early in the morning or late in the afternoon.

The overall mood of the painting is one of peace and serenity, with the figures appearing to be"
Q18685384,http://www.wikidata.org/entity/Q18685384,Q18685384.jpg,1815,,,The Blind Worker,,"The image is a black-and-white drawing or painting depicting three figures seated on the ground. The central figure is a man with curly hair and a beard, dressed in a long robe or cloak. He appears to be kneeling or sitting on the ground, holding a young child in his arms. The child is dressed in a simple garment, possibly a dress, and is looking up at the man.

To the right of the central figure, there is another child, also dressed in a simple garment. This child is also looking up at the man.

The background of the image is plain, with no additional details or objects visible. There is no text or additional figures in the background.

The drawing is done in a realistic style, with fine lines and shading to create depth and dimension. The figures are well-detailed, and the expressions on their faces are clear and expressive. The man's posture and the child's gaze suggest a moment of interaction or interaction"
Q18748498,http://www.wikidata.org/entity/Q18748498,Q18748498.jpg,1800,,,Portrait of El General Ricardos,,"The image is a black-and-white portrait of a man who appears to be seated. He is dressed in formal attire, with a dark jacket over a lighter-colored garment. The jacket has intricate designs and appears to be embroidered with various patterns and symbols. The sleeves of the jacket are adorned with buttons, and there is a prominent emblem on the chest. The man's hair is neatly combed back, and he has a composed expression on his face. He is seated in a relaxed posture, with one hand resting on his lap and the other holding a small object, possibly a pen or a piece of paper.

The background of the image is dark, which helps to focus attention on the man and his attire. There are no other objects or elements in the background, ensuring that the focus remains solely on the man.

### Analysis and Description:

1. **Attire**: The man is wearing a dark jacket over a lighter-colored garment. The jacket has"
Q18811669,http://www.wikidata.org/entity/Q18811669,Q18811669.jpg,1797,,,"Mariana Waldstein, Ninth Marquesa de Santa Cruz",,"The painting or drawing depicts a woman standing on a grassy plain. She is wearing a long black dress that appears to be made of feathers or fur, and she is also wearing a black hat with a bow on it. Her hair is dark and curly, and she has a small smile on her face as she looks directly at the viewer. In the background, there are rolling hills and some trees, suggesting a rural or countryside setting. The sky is overcast, and there are no visible clouds in the sky. The painting is done in a realistic style, and the artist has used light and shadow to create a sense of depth and atmosphere."
Q18915957,http://www.wikidata.org/entity/Q18915957,Q18915957.jpg,1806,,,Woman with a Fan,,"The image depicts a portrait of a young woman seated on a chair. She appears to be of fair complexion, with light brown hair styled in loose curls. She is wearing a light-colored dress with a floral pattern and a white lace trim around the neckline and sleeves. The dress has a fitted bodice and a flared skirt, giving it a classic and elegant appearance.

The woman is holding a knife in her right hand, poised over a piece of fabric that she seems to be about to cut. Her left hand is resting on the chair's arm, suggesting a moment of contemplation or preparation. The background of the image is a dark, neutral color, which helps to focus attention on the woman and her attire.

The woman's expression is calm and composed, with a slight smile on her face. Her gaze is directed towards the viewer, creating a sense of intimacy and connection between the viewer and the subject. The lighting in the image is soft and diffused"
Q18925567,http://www.wikidata.org/entity/Q18925567,Q18925567.jpg,1806,,,Portrait of a Man,,"The painting depicts a young man seated at a table. He is dressed in a gray coat with white trim around the collar and cuffs. His hair is dark and wavy, and he has a slight smile on his face. He holds a pen in his right hand, resting on the table in front of him. The background of the painting is dark, creating a sense of depth and focus on the subject.

The table on which the man is seated has a few items on it. To the left side of the table, there is a black inkwell with what appears to be ink or paint in it. Next to the inkwell, there is a folded piece of paper with what looks like handwriting or notes on it. On the right side of the table, there appears to be a small object, possibly a book or some other small item.

The overall style of the painting is realistic, with attention to detail in the man's clothing and the objects on the table."
Q18926011,http://www.wikidata.org/entity/Q18926011,Q18926011.jpg,1791,,,Portrait of Luis María de Cistué Martínez,,"The image appears to be a painting or drawing of a young girl standing next to a small dog. The girl is depicted with long red hair and is wearing a dark blue dress with a pink sash tied around her waist. She has a serious expression on her face and is holding the dog's leash in her right hand. The dog, which appears to be a small breed, is standing next to the girl on her left side.

The background of the image is a plain, light green color, which provides a neutral backdrop for the girl and the dog. There are no other objects, people, or text present in the image.

The text at the bottom of the image reads ""D. Luis Maria de Cistue y Marínez. Alos dos anos y ocho meses d suer"" which translates to ""D. Luis Maria de Cistue y Marínez. 20 years old and 20 months old"" in English"
Q19163180,http://www.wikidata.org/entity/Q19163180,Q19163180.jpg,1789,,La reina María Luisa,Queen María Luisa,,"The painting depicts a woman from the 18th century. She is standing with her left hand on her hip and her right hand holding a paintbrush. She is wearing a dark-colored dress with a brocure bodice and a lighter-colored skirt. She is also wearing a large hat with a wide brim and a feather in it. Her hair is styled in an elaborate manner, with buns on either side of her head.

In the background, there is a green fabric that appears to be draped over a cushioned surface, possibly a bed or a chaise lounge. The background is dark, which contrasts with the light colors of the woman's dress and hat.

The painting is done in a realistic style, with attention to detail in the clothing and hairstyle. The woman's expression is calm and composed, with a slight smile on her face. The overall mood conveyed by the painting is one of elegance and sophistication."
Q19857280,http://www.wikidata.org/entity/Q19857280,Q19857280.jpg,1804,,,An Officer (probably the Count of Teba),,"The painting depicts a man in a dark green coat adorned with gold and silver embroidery. His hair is dark and appears to be neatly combed. He has a serious expression on his face and is looking directly at the viewer. The background of the painting is dark, which contrasts with the lighter colors of the coat and the man's face, making him stand out more prominently. The man's attire suggests that he might be from a noble or aristocratic family, possibly from the 17th or 18th century given the style of the coat and the elaborate embroidery.

The painting is done in a realistic style, with attention to detail in the man's facial features and clothing. The artist has used light and shadow to create depth and dimension in the image, making the man appear more lifelike. The overall composition of the painting is balanced, with the man's head and shoulders occupying the majority of the frame, while the background remains relatively uncluttered.

Given the"
Q19857281,http://www.wikidata.org/entity/Q19857281,Q19857281.jpg,1785,,,"Don Pedro, Duque de Osuna",,"The painting or drawing depicts a historical figure, likely from the 18th or 19th century, based on the style and clothing. The individual is dressed in a black coat with white trim around the collar and cuffs. The coat has a high collar, and the sleeves are rolled up to just below the elbow. The individual is wearing a white cravat around their neck, and their hair is styled in powdered wigs. The background of the painting is dark, possibly black, which helps to focus attention on the figure in the foreground.

The person in the painting is standing with their left hand resting on their hip and their right hand holding what appears to be a rolled-up piece of paper or a wallet. This suggests that the individual might be engaged in some form of business or personal activity. The expression on the person's face is calm and composed, with a slight smile.

The painting is done in a realistic style, with attention to detail in"
Q19905291,http://www.wikidata.org/entity/Q19905291,Q19905291.jpg,1800,"Ferdinand VII (1784–1833), When Prince of Asturias","Fernando, príncipe de Asturias","Ferdinand VII (1784–1833), Prince of Asturias",,"The image depicts a portrait of a man who appears to be from the 18th century. He is dressed in what seems to be formal attire, characterized by a light-colored coat adorned with gold and red accents. The coat has a high collar, and the sleeves are rolled up to the elbows. The man has a white wig on his head, and he is wearing a white cravat around his neck.

The background of the image is dark, which contrasts with the lighter tones of the man's clothing. There is an oval frame around the portrait, which adds a decorative element to the image. The frame is made of wood and has a dark brown color.

The man's expression is calm and composed, and he seems to be looking directly at the viewer. His facial features are well-defined, and he has a slight smile on his face. His hair is light-colored and appears to be slightly wavy, giving him a classic appearance."
Q19911709,http://www.wikidata.org/entity/Q19911709,Q19911709.jpg,1820,"Tiburcio Pérez y Cuervo (1785/86–1841), the Architect",,"Portrait of Tiburcio Pérez y Cuervo, the Architect",,"The image depicts a portrait of a young man who appears to be of fair complexion. He is dressed in a dark-colored vest over a light-colored shirt with a white collar. His hair is dark and neatly styled, and he has a slight smile on his face. The background of the image is dark, which helps to make the subject stand out more prominently.

The man is standing with his left hand folded across his chest and his right hand resting on his hip. His posture suggests a sense of confidence and self-assurance. The lighting in the image is soft and diffused, creating a warm and inviting atmosphere.

In the lower left corner of the image, there is a watermark that reads ""A THERDALE DORN"" in a cursive font. The watermark is small and does not detract from the main subject of the image.

The overall composition of the image is simple yet effective, focusing on the subject and his attire."
Q19911764,http://www.wikidata.org/entity/Q19911764,Q19911764.jpg,1800,"José Costa y Bonells (died l870), Called Pepito",,"José Costa y Bonells, Called Pepito",,"The painting depicts a young boy standing next to a horse. The boy is wearing a green velvet jacket with gold trim, white pants, and yellow shoes. He holds a hat in his left hand, which appears to be a flat hat with a wide brim. The horse he is standing next to is brown and has a saddle on its back. In the background, there is a drum on the left side of the image and a chair on the right side. The backdrop is a plain, dark gray wall.

The painting is done in a realistic style, with attention to detail in the clothing, the horse, and the setting. The boy's expression is serious, and he seems to be looking directly at the viewer. The overall composition of the painting is balanced, with the boy in the foreground and the horse in the background, creating a sense of depth and focus.

### Analysis and Description:
1. **Subject**: The painting depicts a young boy standing next to a horse"
Q19911877,http://www.wikidata.org/entity/Q19911877,Q19911877.jpg,1815,Narcisa Barañana de Goicoechea,,Narcisa Barañana de Goicoechea,,"The painting depicts a young woman seated on a chair. She is wearing a dark-colored dress with a high collar and a black veil that covers her head. The veil has a lace trim around it, adding a touch of elegance to her appearance. She is also wearing a brooch on her right shoulder. Her hair is dark and pulled back into a neat bun.

The background of the painting is plain and unadorned, allowing the focus to remain on the woman. There are no other objects or figures in the background, keeping the viewer's attention solely on the woman.

The woman's expression is calm and serene, with a slight smile on her face. Her gaze is directed towards the viewer, creating a sense of intimacy and connection between the viewer and the subject.

The painting is done in a realistic style, with attention to detail in the clothing and the woman's facial features. The artist has used light and shadow to create depth and dimension in the image"
Q19912000,http://www.wikidata.org/entity/Q19912000,Q19912000.jpg,1804,Josefa de Castilla Portugal y van Asbrock de Garcini (1775–about 1850),,Portrait of Josefa de Castilla Portugal y van Asbrock de Garcini,,"The image depicts a portrait of a young woman seated against a dark background. She appears to be of fair complexion with long, wavy, light brown hair that cascades over her shoulders. She is wearing a light-colored, possibly white, gown that drapes over her shoulders and extends to her knees. The gown has a ruched bodice and appears to be made of a soft, possibly silk-like fabric.

The woman is holding a small object in her right hand, which could be a book, a pen, or some other small item. Her expression is calm and serene, with a slight smile on her face. Her gaze is directed towards the viewer, and she seems to be in a contemplative or reflective mood.

The background of the image is plain and dark, providing a stark contrast to the light subject of the woman. There are no other objects or figures in the background, keeping the focus solely on the woman.

The painting style"
Q19912222,http://www.wikidata.org/entity/Q19912222,Q19912222.jpg,1804,"Ignacio Garcini y Queralt (1752–1825), Brigadier of Engineers",,Portrait of Ignacio Garcini y Queralt,,"The image depicts a portrait of a young man, likely from the 17th or 18th century, based on his attire and the style of the clothing. The man is dressed in a black coat with red trim, which is characteristic of the fashion of that period. The coat has multiple buttons down the front, indicating a high level of formality. The sleeves of the coat are slightly puffed at the wrists, and the collar of the coat is adorned with a badge or emblem.

The man has light-colored hair and is wearing a white cravat around his neck. The cravat appears to be made of the same fabric as the coat and is tied in a knot at the front. His facial expression is neutral, and he is looking directly at the viewer, suggesting a calm and composed demeanor.

The background of the image is plain and dark, which helps to focus attention on the subject. There are no other objects, people, or elements in the"
Q19962735,http://www.wikidata.org/entity/Q19962735,Q19962735.jpg,1810,Where There's a Will There's a Way (A way of Flying),,Where There's a Will There's a Way (A way of Flying),,"The image appears to be a black and white drawing or painting. In the center of the image, there are two human-like figures. The figure on the left appears to be nude, while the figure on the right is wearing a loincloth. Both figures have large, bat-like wings spread out behind them. The wings are dark in color and appear to be made of some sort of material, possibly leather or fabric.

In the background, there are several birds flying in the air. The birds are depicted in a similar manner to the human figures, with large wings spread out behind them. The background of the image is completely black, which makes the figures and birds stand out vividly.

There is no text or additional elements in the image.

### Analysis and Description:
The image depicts two human-like figures, one of whom is nude and the other wearing a loincloth. Both figures have large, bat-like wings spread out behind"
Q20007353,http://www.wikidata.org/entity/Q20007353,Q20007353.jpg,1790,,,"Portrait of Charles IV, King of Spain",,"The painting depicts a man standing next to a dog. The man is wearing a black hat, a yellow coat with blue and red trim, and black knee-high socks. He holds a long stick in his right hand, which appears to be a walking stick. The dog is sitting on its haunches, facing the man, and has a collar around its neck. In the background, there is a landscape with rolling hills and a dark, cloudy sky. The painting is done in a realistic style, with attention to detail in the man's clothing and the dog's fur."
Q20007355,http://www.wikidata.org/entity/Q20007355,Q20007355.jpg,,,,Portrait of Maria Luisa di Parma,,"The painting or drawing depicts a woman standing in front of a dark background. She is wearing a yellow dress with intricate designs and appears to be of fair complexion. Her hair is styled in an elegant updo, and she is wearing a pearl necklace and earrings. She holds a sword in her right hand, and her left hand is clasped in front of her. 

The background is plain and dark, which contrasts with the bright colors of the woman's dress and accessories. There are no other objects or figures in the background, keeping the focus solely on the woman. The lighting in the painting is soft and diffused, creating a warm and inviting atmosphere.

The woman's expression is calm and composed, with a slight smile on her face. Her gaze is directed towards the viewer, and she seems to be in a moment of quiet contemplation. The overall composition of the painting is balanced, with the woman's figure placed centrally within the frame, drawing the viewer's"
Q20018301,http://www.wikidata.org/entity/Q20018301,Q20018301.jpg,1780,,,Saint Ignacius of Loyola,,"The image appears to be a painting or drawing of a man with a bald head. He is wearing a dark-colored garment, possibly a suit, and has a serious expression on his face. He is holding a rolled-up paper in his right hand, which seems to have text written on it. The text on the paper includes the words ""AP"" and ""MAJOREM DEI GLORIA"". The background of the image is plain and dark, which helps to focus the viewer's attention on the man and the paper he is holding. There are no other objects, people, or elements present in the image, except for the man and the rolled-up paper.

### Analysis and Description:
1. **Subject**: The primary subject of the image is a man with a bald head. He is wearing a dark-colored garment, possibly a suit, and has a serious expression on his face.
2. **Attire**: The man is wearing a dark"
Q20032142,http://www.wikidata.org/entity/Q20032142,Q20032142.jpg,1802,,,José Queraltó,,"The image depicts a portrait of a man who appears to be in his late 20s or early 30s. He is dressed in formal attire, characterized by a black coat with white and red accents, a white cravat around his neck, and a red scarf around his neck. The man's hair is white and appears to be neatly combed. He has a calm and composed expression on his face, looking directly at the viewer.

In the lower part of the image, the man holds a folded piece of paper in his right hand. The paper seems to have some text or writing on it, though the specific content is not clear from the image. The background of the image is dark, possibly black, which makes the man and his attire stand out prominently.

The overall style of the image is classic and formal, typical of portraits from the 18th or early 19th century. The man's attire and the dark background contribute to"
Q20032143,http://www.wikidata.org/entity/Q20032143,Q20032143.jpg,1807,,,Marquesa de Caballero,,"The painting depicts a woman seated on an ornate, upholstered chair. She appears to be of fair complexion, with dark hair styled in loose curls. She is wearing a sleeveless, light-colored dress adorned with gold and bronze-like patterns. The dress has a high neckline and appears to be made of a textured fabric, possibly silk or a similar material.

The woman holds a paintbrush in her right hand, which is resting on the arm of the chair. Her left hand is gently resting on the chair's arm. She is also wearing a necklace with a pendant in the shape of a flower. The flower appears to be made of a combination of green leaves and white petals, giving it a delicate and elegant appearance.

The background of the painting is dark, creating a contrast between the light-colored dress and the dark background. There are no other discernible objects or figures in the background, allowing the focus to remain on the woman"
Q20088067,http://www.wikidata.org/entity/Q20088067,Q20088067.jpg,1793,,,The Shipwreck,,"The painting depicts a dramatic scene of a group of people on a rocky shore. In the foreground, there are several individuals who appear to be in distress. Some of them are lying on the rocky surface, while others are sitting or lying on the ground. The most prominent figure in the image is a woman who is standing with her arms raised in the air. She appears to be in a state of exultation or triumph. Her body language suggests that she may have just escaped from a dangerous situation or achieved a significant victory.

In the background, there is a large rock formation that juts out into the water. The water is turbulent, with waves crashing against the rocks. The sky above is dark and stormy, with flashes of lightning illuminating the scene. The overall mood of the painting is one of drama and urgency, as the people on the shore seem to be caught up in a moment of great significance.

The painting is done in a realistic style, with attention to detail"
Q20178241,http://www.wikidata.org/entity/Q20178241,Q20178241.jpg,1824,"Bullfight, Suerte de Varas",,"Bullfight, Suerte de Varas",,"The painting depicts a scene from a horse racing event. In the foreground, there is a brown bull with a red marking on its forehead. The bull is positioned on the right side of the image and is facing towards the left. The bull's head is lowered, and its ears are perked up, indicating that it is alert.

In the center of the image, there is a group of people. They are dressed in period-appropriate clothing, which suggests that the painting is set in the 18th or 19th century. The people are engaged in what appears to be a horse race. One of the individuals is holding a whip, which is a common tool used in horse racing to control the horses.

The background of the image shows a dirt track, which is typical for horse racing events. There is a fence in the background, which serves as a boundary for the racetrack. The fence is made of wood and is painted in a dark color"
Q20181309,http://www.wikidata.org/entity/Q20181309,Q20181309.jpg,1801,Don Antonio Noriega,,Don Antonio Noriega,,"The painting depicts a man seated in a richly decorated chair. He is wearing a dark-colored coat adorned with gold embroidery, which extends to his neck and shoulders. The coat has intricate designs and appears to be made of fabric, possibly velvet or a similar material. He is also wearing a high-collared shirt that matches the coat, adding to the overall elegance of his attire.

The man has blond hair that is pulled back into a low bun, and he is clean-shaven. His facial expression is neutral, and he is looking directly at the viewer. The background of the painting is dark, which contrasts with the lighter colors of the man's clothing and coat.

In the lower left corner of the painting, there is a table covered with a green cloth. On top of the table, there appears to be a folded piece of paper, possibly a letter or a document. The table's surface is dark, contrasting with the lighter tones of the man's clothing"
