id,uri,file,inception,title_en,title_es,label_en,label_es,caption
Q64956284,http://www.wikidata.org/entity/Q64956284,Q64956284.jpg,,Dos grupos de picadores arrollados  de seguida por un solo toro (Two Teams of Picadors Thrown One after the Other by a Single Bull),,Dos grupos de picadores arrollados  de seguida por un solo toro (Two Teams of Picadors Thrown One after the Other by a Single Bull),,"The image is a black-and-white drawing or painting that appears to depict a chaotic scene involving multiple people and animals. The primary focus of the image is on a group of people engaged in what seems to be a physical altercation or struggle. The individuals are depicted in various positions, some lying down, others standing, and some in mid-air, suggesting they are in the midst of a violent confrontation.

### Objects Present in the Image:

1. **People**: 
   - There are multiple people in the image.
   - They appear to be engaged in a physical altercation or struggle.
   - Some are lying down, others are standing, and some are in mid-air.

2. **Animals**:
   - There are at least two animals in the image.
   - One of the animals appears to be a horse, while the other might be a dog or another type of canine.

3. **Background**:
   - The background of the image is"
Q64956285,http://www.wikidata.org/entity/Q64956285,Q64956285.jpg,,La desgraciada muerte de Pepe Illo en la plaza de Madrid (The Unlucky Death of Pepe Illo in the Ring at Madrid),,La desgraciada muerte de Pepe Illo en la plaza de Madrid (The Unlucky Death of Pepe Illo in the Ring at Madrid),,"The image is a black-and-white drawing or painting that appears to depict a scene from a historical or mythological context. The primary subject of the image is a man and a bull. The man is positioned on the left side of the image, facing the bull. He appears to be in a defensive stance, with his knees bent and his arms outstretched. The bull is positioned in the center of the image, facing the man. Its head is lowered, and its horns are visible.

In the background, there are two additional figures. One of the figures appears to be a woman, dressed in traditional attire. She is standing on the left side of the image and seems to be interacting with the bull. The other figure is a man, dressed in a more modern outfit. He is standing on the right side of the image and seems to be observing the interaction between the man and the bull.

The background of the image is composed of what appears to be a desert"
Q64956286,http://www.wikidata.org/entity/Q64956286,Q64956286.jpg,1804,Dios se lo pague a vsted (May God Repay You),,Dios se lo pague a vsted (May God Repay You),,"The image appears to be a detailed drawing or painting of a scene involving a bull and a person. The focal point of the image is the bull, which is depicted as a large, muscular animal with a long, curved horn on its forehead. The bull is positioned facing the viewer, with its head turned slightly to the left. The bull's body is covered in short, dark hair, and its legs are muscular and well-defined.

The person in the image is riding on the back of the bull. The person is dressed in traditional attire, consisting of a long, hooded cloak that covers their head and shoulders. The cloak appears to be made of a dark fabric, possibly leather or a similar material. The person is holding a guitar in their right hand, and their left hand appears to be gripping the bull's horns. The person's face is not clearly visible, but they seem to be focused on playing the guitar.

The background of the image is plain, with"
Q64956288,http://www.wikidata.org/entity/Q64956288,Q64956288.jpg,,The Garroted Man,,The Garroted Man,,"The image is a pencil drawing of a man seated on a chair. The man is depicted with a beard and long hair, dressed in a long, flowing robe. He has a serious expression on his face and appears to be in a contemplative or reflective state. His posture suggests he might be in deep thought or deep contemplation.

The chair he is seated on is ornately designed, with a high back and armrests. The chair is positioned against a plain backdrop, which could be a wall or another piece of furniture. There is a candle placed on the right side of the chair, suggesting that the man might be in a moment of quiet reflection or contemplation.

The drawing is done in a realistic style, capturing the details of the man's clothing, posture, and facial expression. The artist has used shading to create depth and dimension, emphasizing the contours of the man's body and the texture of the fabric. The overall composition of the image is balanced, with the man's"
Q64956289,http://www.wikidata.org/entity/Q64956289,Q64956289.jpg,,"Francesco Goya y Lucientes, Pintor",,"Francesco Goya y Lucientes, Pintor",,"The image depicts a black-and-white drawing or painting of a man. The man is depicted from the waist up, and he is wearing a top hat. His hair is long and appears to be slightly disheveled. He is dressed in a long-sleeved shirt and a jacket. The man's expression is serious, and he seems to be looking directly at the viewer.

The background of the image is plain and unadorned. There are no other objects, people, or text present in the image.

**Analysis and Description:**

1. **Art Style:**
   - The image appears to be a sketch or drawing rather than a photograph.
   - The use of black and white suggests a historical or classical style.

2. **Subject:**
   - The subject is a man.
   - He is wearing a top hat.
   - His attire includes a long-sleeved shirt and a jacket.

3. **Expression and"
Q64956300,http://www.wikidata.org/entity/Q64956300,Q64956300.jpg,,Quien mas rendido?  (Which of Them Is the More Overcome?),,Quien mas rendido?  (Which of Them Is the More Overcome?),,"The image appears to be a black-and-white drawing or painting. In the center of the image, there is a depiction of three women. The woman on the left has long hair and is wearing a dress. The woman in the middle has short hair and is also wearing a dress. The woman on the right has long hair and is wearing a dress as well. All three women are looking at each other and appear to be engaged in a conversation. 

In the lower part of the image, there is text that reads ""Queen mas rendido."" This text is written in a cursive script and appears to be the name of the woman depicted in the image. 

The background of the image is plain and unadorned. There are no other objects, people, or elements present in the image that would distract from the depiction of the three women. 

The image does not contain any additional objects, such as furniture, animals, or other people, which helps to keep"
Q64956312,http://www.wikidata.org/entity/Q64956312,Q64956312.jpg,,Que viene el coco (Here Comes the Bogey-Man),,Que viene el coco (Here Comes the Bogey-Man),,"The image is a black-and-white drawing or painting. The central figure in the image is a woman seated on a bed. She has short hair and is wearing a light-colored dress. The woman appears to be crying or distressed, with her eyes closed and her mouth slightly open. She is holding a young child close to her chest. The child is also wearing a light-colored dress and appears to be crying as well.

To the right of the seated woman, there is a person dressed in a long, dark robe. This person seems to be looking at the seated woman and child. The person in the robe has long hair and is also wearing a light-colored garment.

The background of the image is plain, with no additional details or objects visible. There are no other people, animals, or objects present in the image.

In the lower part of the image, there is a caption written in a cursive script. The text reads: ""I"
Q64956331,http://www.wikidata.org/entity/Q64956331,Q64956331.jpg,,Por que fue sensible (Because She Was Susceptible),,Por que fue sensible (Because She Was Susceptible),,"The image is a black-and-white photograph of a woman seated on the floor. She appears to be in a dimly lit room with a dark wall behind her. The woman is wearing a light-colored garment, possibly a dress, and her hair is tied back. She is sitting with her legs crossed and her hands resting on her knees. Her posture suggests she might be in a state of relaxation or contemplation.

In the lower part of the image, there is text written in a cursive script. The text reads ""Por que fie sensible,"" which translates to ""Why is it sensible."" The text is positioned at the bottom of the image and appears to be part of a caption or an annotation related to the photograph.

The background of the image is plain, with no additional details or objects visible. There are no other people, furniture, or objects present in the image.

### Analysis and Description:
1. **Subject**: The photograph depicts"
Q64956368,http://www.wikidata.org/entity/Q64956368,Q64956368.jpg,,El amour y la muerte (Love and Death),,El amour y la muerte (Love and Death),,"The image is a black-and-white drawing or painting. The primary subject of the image is a man and a woman who appear to be embracing each other. The man is positioned on the right side of the image, with his left arm wrapped around the woman, who is on the left side of the image. Both individuals are dressed in casual clothing, suggesting a moment of intimacy and affection.

The background of the image consists of a plain, outdoor setting, possibly a courtyard or an open space. There are no other objects or elements in the background, which helps to keep the focus on the couple. The lighting in the image is soft and diffused, creating a calm and intimate atmosphere.

There is text at the bottom of the image that reads ""Flamor y la muerte,"" which translates to ""Flame and Death"" in English. This text is written in a cursive script, adding a personal touch to the image.

### Analysis and Description"
Q64956371,http://www.wikidata.org/entity/Q64956371,Q64956371.jpg,,Quien lo creyera! (Who Would Have Thought It!),,Quien lo creyera! (Who Would Have Thought It!),,"The image is a sepia-toned drawing or painting. The primary subject of the image is a nude woman lying on a tree branch. She appears to be in a state of distress, with her body twisted and her limbs outstretched. Her facial expression is one of pain or agony, with her eyes closed and her mouth slightly agape. The woman's skin is pale, and her hair is disheveled.

In the background, there is another figure lying on the ground. This figure appears to be a man, and he is also in a state of distress. He is lying on his back, with his arms outstretched and his legs bent at the knees. His face is also in a state of pain, with his eyes closed and his mouth slightly agape.

The background of the image is a dark, shadowy landscape. There are no other figures or objects in the background, which helps to focus the viewer's attention on the"
Q64956375,http://www.wikidata.org/entity/Q64956375,Q64956375.jpg,,A caza de dientes (Out Hunting for Teeth),,A caza de dientes (Out Hunting for Teeth),,"The image appears to be a black-and-white drawing or painting. The central figure in the image is a man and a woman. The man is standing on the right side of the image, facing the woman. He has short hair and is wearing a long-sleeved shirt and pants. The woman is standing on the left side of the image, facing the man. She has long hair and is wearing a long-sleeved dress. The background of the image shows a landscape, possibly a mountain range, with a body of water in the distance. The sky is dark, suggesting it might be dusk or dawn. There is text at the bottom of the image that reads ""A casa de dientes,"" which translates to ""A House of Teeth"" in English. The text is written in a cursive script.

### Analysis and Description:
1. **Central Figure**: The central figure is a man and a woman. The man is standing on the right"
Q64956388,http://www.wikidata.org/entity/Q64956388,Q64956388.jpg,,Asta su abuelo (And So Was His Grandfather),,Asta su abuelo (And So Was His Grandfather),,"The image is a black-and-white drawing or painting of a donkey reading a book. The donkey is depicted in a seated position, wearing a long-sleeved shirt and pants. The donkey's ears are perked up, and it appears to be engaged in reading the book, which is held in its mouth. The donkey's expression is calm and focused, as if it is absorbed in the content of the book.

In the background, there is a plain, neutral-toned wall, which provides a stark contrast to the donkey and the book. There are no other objects or figures in the image, keeping the focus solely on the donkey and the book.

The drawing is done in a realistic style, with fine lines and shading to create depth and dimension. The donkey's fur is detailed, and the texture of its skin is discernible, giving it a lifelike appearance. The donkey's posture and the way it holds the book suggest that it might be"
Q64956396,http://www.wikidata.org/entity/Q64956396,Q64956396.jpg,,Ni mas ni menos (Neither More nor Less),,Ni mas ni menos (Neither More nor Less),,"The image is a black-and-white drawing or painting. In the foreground, there is a kangaroo sitting on its haunches. The kangaroo appears to be looking down at a human who is kneeling on the ground in front of it. The human is wearing a hat and appears to be interacting with the kangaroo. In the background, there is a structure that looks like a barrel or a barrel-like object. There is text at the bottom of the image that reads ""Ni mea ni menos,"" which translates to ""No, no, no"" in English.

### Analysis and Description:

1. **Subjects and Objects**:
   - **Kangaroo**: The kangaroo is the main subject of the image. It is depicted in a squatting position, facing the human who is kneeling.
   - **Human**: The human is kneeling on the ground in front of the kangaroo. He is wearing a hat and appears to be interacting with the kangaroo."
Q64956413,http://www.wikidata.org/entity/Q64956413,Q64956413.jpg,,El sueño de la razon produce monstruos (The Sleep of Reason Produces Monsters),,El sueño de la razon produce monstruos (The Sleep of Reason Produces Monsters),,"The image appears to be a black-and-white drawing or painting. The primary subject of the image is a woman sitting on the ground with her head bowed and her hands covering her face. She is wearing a long dress and appears to be in a state of distress or mourning.

Surrounding the woman are several other animals, including owls, cats, and birds. These animals are depicted in various positions, some perched on the ground, some flying, and some perched on the woman's shoulders. The animals seem to be engaged in various activities, such as flying, cawing, or looking at the woman.

In the background, there is a large bird with outstretched wings flying towards the right side of the image. This bird appears to be the focal point of the image, as it is larger and more prominent compared to the other animals.

The background of the image is plain, with no additional details or scenery. The sky is depicted as a"
Q64956459,http://www.wikidata.org/entity/Q64956459,Q64956459.jpg,,Duendecitos (Hobgoblins),,Duendecitos (Hobgoblins),,"The image appears to be a black-and-white drawing or painting. The central figure in the image is a clown-like character with exaggerated features. The clown has a deformed face with large, gaping eyes and a wide mouth that is open in a fearful expression. The clown is wearing a dark-colored outfit with a hood, which obscures its head and neck. The clown's arms are outstretched to the sides, and its hands are clenched into fists.

Surrounding the clown are three other characters. Two of the characters are lying on the ground. The character on the left is lying on its back with its eyes closed. The character in the middle is lying on its side with its eyes open. The character on the right is also lying on its side with its eyes open. All three characters appear to be in a state of distress or fear.

The background of the image is plain and nondescript. There are no other objects"
Q64956515,http://www.wikidata.org/entity/Q64956515,Q64956515.jpg,,Y son fieras (And They Are Like Wild Beasts),,Y son fieras (And They Are Like Wild Beasts),,"The image is a black-and-white drawing or painting. The primary subject of the image is a group of people engaged in what appears to be a dramatic or intense moment. The focal point of the image is a woman who is lying on the ground, seemingly injured or incapacitated. She is dressed in a sleeveless dress with a high neckline, and her hair is disheveled, suggesting that she may have been involved in an accident or struggle.

To the left side of the image, there is another person who appears to be assisting the injured woman. This person is dressed in a long dress, and they are holding a large object, possibly a weapon or a tool, which is being used to assist the injured woman. This person is wearing a hat and appears to be focused on the injured woman.

To the right side of the image, there is another person who is also dressed in a long dress. This person is holding a similar large object"
Q64956520,http://www.wikidata.org/entity/Q64956520,Q64956520.jpg,,Por que? (Why?),,Por que? (Why?),,"The image is a black-and-white drawing or painting depicting three men engaged in what appears to be a physical altercation. The scene is set outdoors, with trees and possibly a body of water in the background, suggesting a natural setting. The men are dressed in traditional clothing, which includes long pants, long-sleeved shirts, and hats. The man on the left is holding a large oar, which he appears to be using to block or push one of the other men. The man in the middle is also holding an oar, but he seems to be in a defensive stance, possibly trying to protect himself from the other man. The man on the right appears to be in a defensive stance as well, but he is not holding an oar.

The expressions on the faces of the men suggest that they are in the middle of an argument or confrontation. The man on the left has a look of determination or anger on his face, while the man in the"
Q64956523,http://www.wikidata.org/entity/Q64956523,Q64956523.jpg,,Que valor! (What Courage!),,Que valor! (What Courage!),,"The image is a black-and-white print of an etching. The central figure in the image is a woman standing on top of a large barrel. She is dressed in a long, flowing gown, and her hair is pulled back into a bun. She appears to be in a moment of contemplation or deep thought, as her gaze is directed off to the right side of the image.

To the left of the woman, there are two men lying on the ground. They appear to be dead, and their faces are not clearly visible. One of the men is lying on his back, while the other is lying on his side. The ground around them is uneven and appears to be sandy or rocky.

In the background, there is a large, cylindrical object, which could be a barrel or another type of large container. This object is partially obscured by the woman and the men lying on the ground.

The image is signed ""Jules Sulor"" in the"
Q64956541,http://www.wikidata.org/entity/Q64956541,Q64956541.jpg,,No se puede saber por que (One Can't Tell Why),,No se puede saber por que (One Can't Tell Why),,"The image is a black-and-white drawing or painting depicting a group of people seated on what appears to be a wooden bench or platform. The individuals are arranged in a semi-circle around a central figure, who is positioned in the center of the bench. This central figure is holding a piece of paper, which seems to be written in a foreign language. The people in the image are dressed in formal attire, including suits, hats, and ties, suggesting that they might be attending a formal event or meeting.

The background of the image is plain and nondescript, with no additional elements such as trees, buildings, or other objects. There is no indication of the time of day or weather conditions, which helps to keep the focus on the people and their attire.

The individuals in the image appear to be engaged in some form of discussion or presentation, as they are all looking at the central figure and appear to be listening attentively. The expressions on their faces range from"
Q64956556,http://www.wikidata.org/entity/Q64956556,Q64956556.jpg,,Ni por esas (Neither Do These),,Ni por esas (Neither Do These),,"The image appears to be a black-and-white drawing or painting. The primary subject of the image is a group of people engaged in what seems to be a physical altercation. The focal point of the image is a man in the foreground who appears to be in the midst of a sword fight. He is holding a sword in his right hand, and his left arm is outstretched towards another person, who is lying on the ground. The man in the foreground is wearing a helmet, which suggests that he might be a warrior or a soldier.

In the background, there are several other people, some of whom are also engaged in sword fights. The people in the background appear to be in various states of distress, with some of them lying on the ground and others appearing to be injured. There is also a building in the background, which could be a castle or another type of fortification.

The painting is done in a realistic style, and the figures are depicted in"
Q64956578,http://www.wikidata.org/entity/Q64956578,Q64956578.jpg,,Y no hai remedio (And There's No Help for It),,Y no hai remedio (And There's No Help for It),,"The image is a black-and-white drawing or painting. The central figure in the image is a person lying on the ground. The person is dressed in a white garment and appears to be in a state of distress or exhaustion. The person's face is not clearly visible, but their body language suggests they are in a state of distress or pain.

To the left of the central figure, there is another person standing. This person is also dressed in a white garment and appears to be in a state of distress or exhaustion. The person's body language suggests they are also in a state of distress or exhaustion.

To the right of the central figure, there is another person lying on the ground. This person is also dressed in a white garment and appears to be in a state of distress or exhaustion. The person's body language suggests they are in a state of distress or exhaustion.

In the background, there is a structure that appears to be a house or a building"
Q64956595,http://www.wikidata.org/entity/Q64956595,Q64956595.jpg,,No se convienen (They Do Not Agree),,No se convienen (They Do Not Agree),,"The image appears to be a black-and-white drawing or painting. The primary subject of the image is a group of people engaged in what seems to be a hunting or fishing activity. The central figure is a man on a horse, holding a knife in his right hand. He is dressed in traditional hunting attire, including a hat, a long coat, and a breechcloth. The horse he is riding appears to be a dark color, possibly brown or black.

Surrounding the central figure, there are several other individuals, some of whom appear to be engaged in the same activity. They are also dressed in traditional hunting attire, including hats, long coats, and breechcloths. Some of these individuals are on horseback, while others are on foot.

In the background, there is a large body of water, possibly a river or a lake, with some trees and vegetation visible. The sky is clear, suggesting it might be a sunny day."
Q64956602,http://www.wikidata.org/entity/Q64956602,Q64956602.jpg,,Yo lo vi (I Saw It),,Yo lo vi (I Saw It),,"The image appears to be a black-and-white drawing or painting. The primary subject of the image is a group of people engaged in what seems to be a battle or a confrontation. The individuals are depicted in various poses and gestures, suggesting they are in the midst of a physical altercation.

### Detailed Description:

1. **Foreground and Background**:
    - **Foreground**:
        - There are several individuals in the foreground.
        - They appear to be engaged in a physical altercation.
        - Some of the individuals are holding weapons, such as swords or axes.
        - One person is wearing a hat and appears to be in a defensive stance.
    - **Background**:
        - The background features a landscape with trees and what appears to be a castle or fort.
        - There are other people in the background, some of whom are also engaged in the physical altercation.
        - The landscape suggests a rural or semi-rural setting.

2."
Q64956607,http://www.wikidata.org/entity/Q64956607,Q64956607.jpg,,Y esto tambien (And This Too),,Y esto tambien (And This Too),,"The image is a black-and-white drawing or painting. In the foreground, there are several human figures. On the left side of the image, there is a woman who appears to be kneeling down. She is wearing a dress and has her hair tied back. To her right, there is another woman who is also kneeling down. She is also wearing a dress and has her hair tied back. In the middle of the image, there is another woman who is standing. She is also wearing a dress and has her hair tied back. On the right side of the image, there is another woman who is lying down. She is also wearing a dress and has her hair tied back. In the background, there are more human figures. Some of them are standing, while others are lying down. There is also a dog in the background. The background is filled with a dark, stormy sky. At the bottom of the image, there is text that reads ""Y esto t"
