id,uri,file,inception,title_en,title_es,label_en,label_es,caption
Q64956230,http://www.wikidata.org/entity/Q64956230,Q64956230.jpg,,Un caballero espanol mata un toro despues de haber perdido el caballo (A Spanish Knight Kills the Bull after Having Lost His Horse),,Un caballero espanol mata un toro despues de haber perdido el caballo (A Spanish Knight Kills the Bull after Having Lost His Horse),,"The image appears to be a black-and-white drawing or painting. In the foreground, there are four human figures engaged in a physical altercation. Two of the figures appear to be men, while the other two appear to be women. The men are dressed in armor, which suggests they might be warriors or soldiers. One of the men is holding a sword, while the other is holding a shield. The woman on the left side of the image is holding a spear, while the woman on the right side of the image is holding a shield. 

In the center of the image, there is a large animal, which appears to be a horse. The horse is lying on its side, with its head towards the bottom of the image. The horse's legs are spread out, and it looks as if it is in a state of distress. 

The background of the image is plain, with no other objects or details visible. The overall tone of the image is serious and dramatic"
Q64956231,http://www.wikidata.org/entity/Q64956231,Q64956231.jpg,,Carlos V. lanceando un toro en la plaza de Valladolid (Charles V Spearing a Bull in the Ring at Valladolid),,Carlos V. lanceando un toro en la plaza de Valladolid (Charles V Spearing a Bull in the Ring at Valladolid),,"The image is a black-and-white drawing or painting of a man on a horse. The man is dressed in armor, including a helmet with a visor, and is holding a sword in his right hand. The horse is rearing up on its hind legs, and the man appears to be in motion. The background of the image is plain, with no additional details or objects visible.

**Analysis and Description:**

1. **Armor and Attire:**
   - The man is wearing full armor, including a helmet with a visor.
   - He is also equipped with a sword, which is held in his right hand.

2. **Horse:**
   - The horse is rearing up on its hind legs.
   - The horse's posture suggests it is in motion.

3. **Background:**
   - The background of the image is plain, with no additional details or objects visible.

4. **Art Style:**
   - The image appears to be"
Q64956234,http://www.wikidata.org/entity/Q64956234,Q64956234.jpg,,El Cid Campeador lanceando otro toro  (The Cid Campeador Spearing Another Bull),,El Cid Campeador lanceando otro toro  (The Cid Campeador Spearing Another Bull),,"The image is a black-and-white drawing or painting depicting a scene of conflict. The central figure is a mounted warrior, dressed in armor and wielding a sword and shield. The warrior is positioned on the right side of the image, facing the left, with one arm extended forward and the other holding the shield. The warrior's armor includes a helmet with a visor, a breastplate, and leg guards. The visor appears to be open, revealing the warrior's face, which is partially obscured by the helmet.

The warrior is mounted on a large, dark brown horse. The horse has a long, flowing mane and tail, indicative of a wild or feral horse. The horse's posture suggests it is either charging or preparing to charge, with its front legs extended forward and its hind legs slightly bent.

In the background, there is a large, dark brown bull. The bull is facing the warrior, with its head lowered and its horns pointed forward."
Q68975875,http://www.wikidata.org/entity/Q68975875,Q68975875.jpg,1815,,,Don Juan Bautista de Goicoechea y Urrutia,,"The image depicts a portrait of a man who appears to be in his late 30s or early 40s. He has light brown hair that is combed back, and he is wearing a black coat with gold embroidery. The coat has intricate designs on it, including what appears to be stars and possibly other symbols. The man is also wearing a white cravat around his neck. His facial expression is neutral, and he is looking directly at the viewer.

The background of the image is a dark, solid color, which helps to make the man stand out prominently. There are no other objects or elements in the background, keeping the focus solely on the man. The lighting in the image is soft and even, casting no harsh shadows, ensuring that the details of the coat and the man's face are clearly visible.

The overall style of the painting is classic and formal, typical of portraits from the 18th or 19th century. The man"
Q71996381,http://www.wikidata.org/entity/Q71996381,Q71996381.jpg,1788,,,José de Cistué y Coll,,"The image depicts a portrait of a person who appears to be a high-ranking official or noble. The individual is dressed in a black robe with a high collar and cuffs, which suggests a formal and dignified appearance. The robe is adorned with intricate patterns and designs, indicating a high level of craftsmanship. The person's head is adorned with a white wig, which is styled in a manner that suggests they are of noble birth.

The individual is holding an object in their left hand, which appears to be a rolled-up piece of paper or a rolled-up document. This suggests that the person might be involved in some form of official business, such as a letter, a document, or a proclamation.

In the background, there is a green fabric draped over a surface, which could be a table, a chair, or another piece of furniture. This fabric adds a sense of depth and context to the image, indicating that the person might be in"
Q71999342,http://www.wikidata.org/entity/Q71999342,Q71999342.jpg,1788,,,José de Cistué y Coll,,"The image depicts a portrait of a man who appears to be a historical figure, likely from the 16th or 17th century. The man is depicted wearing a black robe with a white collar, which is characteristic of the period. His hair is styled in powdered wigs, and he has a stern expression on his face. The background of the image is plain and dark, which helps to focus attention on the subject.

The man's attire suggests that he might have been a noble or a high-ranking official, given the style of the robe and the powdered wigs. The presence of a feather pin on his robe indicates that he might have been a member of the nobility or a high-ranking official.

The background of the image is plain and dark, which helps to draw attention to the subject. The overall tone of the image is serious and dignified, which is consistent with the historical context of the portrait.

The man's expression is"
Q72046674,http://www.wikidata.org/entity/Q72046674,Q72046674.jpg,,,,the witches kitchen,,"The image is a black-and-white drawing or painting that appears to depict a surreal or fantastical scene. The primary objects in the image include:

1. **People**: There are several figures in the image, all of whom appear to be naked or semi-naked. They seem to be engaged in various activities, such as dancing, playing, or interacting with each other. The figures are positioned in a way that suggests they are part of a performance or ritual.

2. **Dog**: A dog is prominently featured in the image. It is standing on its hind legs and appears to be interacting with the other figures. The dog has its front paws on the ground, and its head is turned towards the other figures.

3. **Skulls**: There are several skulls scattered around the scene. Some are placed on the ground, while others appear to be floating or suspended in mid-air. The presence of skulls adds to the surreal atmosphere of the image.

4."
Q72796718,http://www.wikidata.org/entity/Q72796718,Q72796718.jpg,1785,,El almirante José de Mazarredo,Admirał José de Mazarredo,,"The image depicts a portrait of a man seated on what appears to be a wooden table. The man has white hair and is wearing a black military-style coat adorned with gold epaulets and red and gold accents. The coat has a high collar, and the epaulets are prominently displayed. He is also wearing a white cravat around his neck.

In the background, there is a green cloth draped over the top of the table. The cloth seems to be draped from the left side of the image to the right side, creating a sense of depth. Behind the man, the ocean is visible, suggesting that he might be in a coastal setting.

The man's expression is neutral, and he is looking directly at the viewer. His posture is relaxed, with his hands resting on the table in front of him. The lighting in the image is soft and even, with no harsh shadows, indicating that the photograph was taken in a well-lit room"
Q74044155,http://www.wikidata.org/entity/Q74044155,Q74044155.jpg,,Caritas,,Caritas,,"The image appears to be a pen and ink drawing or painting. The central figure in the image is a man with a long white beard. He is dressed in a dark robe with a hood pulled over his head. The man has a serious expression on his face and is looking slightly to the left of the viewer. The background of the image is plain and unadorned, allowing the focus to remain on the central subject.

The drawing is done in a realistic style, and the artist has used shading to create depth and dimension in the man's face and clothing. The shading helps to indicate the contours of the man's facial features and the texture of his robes. The overall composition of the image is simple yet effective, allowing the viewer to focus on the subject without any distractions.

The word ""Cari"" is written at the top of the image, indicating the name of the artist or the title of the piece. The text is written in a serif font, which"
Q75119103,http://www.wikidata.org/entity/Q75119103,Q75119103.jpg,,Los caprichos: Subir y bajar,,Los caprichos: Subir y bajar,,"The image is a sepia-toned drawing or painting. The primary subject of the image is a man lying on the ground. He appears to be in a state of distress, with his arms outstretched and his body twisted in an unnatural position. His face is contorted in a grimace, and he seems to be in pain or distress.

To the left of the man, there is another figure. This person is also lying on the ground and appears to be in a similar state of distress. They have their arms outstretched and their body twisted in an unnatural position. Their face is contorted in a grimace, and they seem to be in pain or distress as well.

In the background, there are two more figures. One of them is standing on the ground, while the other is lying on the ground. They appear to be in a similar state of distress, with their arms outstretched and their bodies twisted in an unnatural position."
Q75119106,http://www.wikidata.org/entity/Q75119106,Q75119106.jpg,,Los caprichos: No hay quien nos desate,,Los caprichos: No hay quien nos desate,,"The image is a sepia-toned drawing or painting. The central figure in the image is a woman who appears to be dancing. She is wearing a long dress and has her hair tied back. She is facing away from the viewer, towards the right side of the image. 

To the left of the woman, there is a large bird with outstretched wings. The bird's wings are spread wide, and it seems to be reaching towards the woman. The bird has large, round eyes and a long, pointed beak. 

The background of the image is plain, with no additional details or objects. There are no other figures, animals, or objects present in the image. 

At the bottom of the image, there is text that reads ""No hay quien nos denta"" which translates to ""No one will touch us."" The text is written in a cursive font, and it is positioned at the bottom of the image. 

The style of the"
Q75122144,http://www.wikidata.org/entity/Q75122144,Q75122144.jpg,,Los caprichos: Estan Calientes,,Los caprichos: Estan Calientes,,"The image appears to be a black-and-white drawing or painting. In the foreground, there is a man seated on a chair. He is wearing a robe and appears to be in a state of distress, with his mouth agape and hands outstretched. Behind him, there is another man who seems to be in a similar state of distress, also with his mouth open and hands outstretched.

In the background, there are two more men. The man on the left appears to be in a state of distress, with his mouth agape and hands outstretched. The man on the right is also in a state of distress, with his mouth open and hands outstretched.

There is text at the bottom of the image that reads ""Eitan calientes,"" which translates to ""Eitan Calientes"" in English. The text is written in a cursive font and appears to be hand-written.

The background of the image is"
Q75122146,http://www.wikidata.org/entity/Q75122146,Q75122146.jpg,,Los caprichos: Buen Viage,,Los caprichos: Buen Viage,,"The image is a sepia-toned drawing or painting. The central figure in the image is a woman lying on her back with her arms outstretched. She appears to be in a state of distress or exhaustion, with her eyes closed and her face contorted in a grimace of pain or distress. Her body language suggests that she is in a state of physical or emotional distress.

The woman is wearing a long, loose-fitting dress that covers her entire body. Her hair is dark and appears to be disheveled, with some strands falling over her face. The background of the image is plain and unadorned, which helps to focus the viewer's attention on the woman.

The painting is done in a realistic style, and the artist has used shading to create depth and dimension. The light source appears to be coming from the upper left side of the image, creating a dramatic effect on the woman's face and body. The overall tone of the"
Q75396191,http://www.wikidata.org/entity/Q75396191,Q75396191.jpg,1824,Maja,,Maja,,"The image is a black-and-white drawing or painting of a young woman. She is depicted standing with her hands on her hips, wearing a long dress with a high neckline. The dress appears to be made of a thick fabric, possibly wool or a similar material, and has a lace or brocade trim around the neckline and sleeves. Her hair is pulled back into a bun, and she is wearing a hat that covers her head. The background of the image is plain and nondescript, with no discernible features or patterns. There are no other objects, people, or text present in the image. The style of the drawing is reminiscent of the Pre-Raphaelite style, characterized by its attention to detail, realism, and the use of fine lines and shading to create depth and texture."
Q76339999,http://www.wikidata.org/entity/Q76339999,Q76339999.jpg,1812,No Hay Quien Los Socorra (Nobody Can Help Them),,No Hay Quien Los Socorra (Nobody Can Help Them),,"The image is a black-and-white drawing or painting that appears to be from a historical or classical period. The primary subject of the image is a man lying on the ground, seemingly injured or dead. He is dressed in a long, loose garment, possibly a shirt and trousers, and his body is partially covered by a blanket. The man's face is not clearly visible, but he appears to be in a state of distress.

To the left side of the image, there is another person lying on the ground. This person is also dressed in a long, loose garment, possibly a shirt and trousers, and appears to be in a similar state of distress. They are also covered by a blanket.

In the background, there is a large, cloud-filled sky, suggesting a dramatic or stormy weather scene. The sky is dark, indicating that it might be dusk or dawn. There are no other figures or objects in the background, focusing the viewer's attention solely on"
Q77974826,http://www.wikidata.org/entity/Q77974826,Q77974826.jpg,1824,Portrait of a Lady in a Black Mantilla,,Portrait of a Lady in a Black Mantilla,,"The image depicts a portrait of a woman who appears to be in her late 20s or early 30s. She has long, dark hair that cascades down her shoulders, and she is wearing a dark-colored dress with a high collar. The dress has a textured pattern that gives it a vintage or classic appearance. Around her neck, she wears a dark-colored scarf or shawl, which adds a touch of elegance and sophistication to her appearance.

The woman's expression is calm and composed, with a slight smile on her face. She is looking directly at the viewer, which suggests that she is either posing for the photograph or simply enjoying the moment. Her makeup is subtle, with a focus on enhancing her features rather than covering them completely.

The background of the image is a plain, dark color, which helps to make the woman the focal point of the portrait. The lighting in the image is soft and diffused, casting gentle shadows that"
Q77975891,http://www.wikidata.org/entity/Q77975891,Q77975891.jpg,1800,El Conde del Tajo,,The Count of the Tagus,,"The image depicts a portrait of a man who appears to be a historical figure, likely from the 18th or 19th century. The man is dressed in formal attire, characterized by a long brown coat with multiple buttons down the front. The coat has a high collar, and the sleeves are rolled up to the elbows. He is also wearing a white cravat tied around his neck. His hair is white and appears to be styled in a powdered wig, giving him a classic and regal appearance.

The background of the image is dark, which contrasts with the lighter colors of the man's clothing and coat. This dark background helps to make the man stand out prominently.

The man's expression is serious and composed, with a slight hint of a smile on his lips. His gaze is directed towards the viewer, and he seems to be looking directly at the viewer.

The painting is done in a realistic style, with attention to detail in the"
Q78366461,http://www.wikidata.org/entity/Q78366461,Q78366461.jpg,1812,Equestrian Portrait of the 1st Duke of Wellington (1769–1852),El duque de Wellington a caballo,Equestrian Portrait of the 1st Duke of Wellington,,"The painting depicts a man seated on a black horse. The man is dressed in a black coat with a white cravat around his neck. His hair is dark and appears to be neatly combed. He is holding the reins of the horse, which is standing on a rocky outcrop. The horse has a dark brown coat with a white blaze on its forehead. The background of the painting is somewhat indistinct, but it appears to be a landscape with rolling hills and a cloudy sky.

The painting is done in a realistic style, with attention to detail in the textures of the horse's coat and the folds in the man's clothing. The lighting in the painting is dramatic, with strong contrasts between light and dark areas, creating a sense of depth and atmosphere. The overall mood conveyed by the painting is one of motion and action, as the man and the horse appear to be in motion on the rocky outcrop.

There are no other objects or figures present in the painting"
Q79394767,http://www.wikidata.org/entity/Q79394767,Q79394767.jpg,1798,,,Portrait of Don Francisco de Saavedra,,"The painting depicts a man seated on a chair in front of a table. The man appears to be in his late 20s or early 30s, with grayish hair and a pale complexion. He is wearing a blue garment with white trim around the collar and cuffs. His right hand is resting on the chair's back, while his left hand holds a pen or a quill, suggesting he might be engaged in writing or drawing.

The table in front of him is cluttered with various objects. On the left side of the table, there is a book or pamphlet, which is partially visible. To the right of the book, there is a glass or a small container, possibly containing ink or a quill. In the center of the table, there is a quill and an inkwell, indicating that the man might be engaged in writing or drawing.

The background of the painting is dark, with a dark green wall behind the man. The"
Q79512923,http://www.wikidata.org/entity/Q79512923,Q79512923.jpg,1810,The Horrors of War:  I Saw It,Yo lo vi,The Horrors of War:  I Saw It,,"The image is a black-and-white photograph framed in a white matte board. The photograph appears to depict a historical scene, possibly from the 19th or early 20th century, given the style and context of the people and objects present.

**Objects Present in the Image:**

1. **People:**
   - There are several individuals visible in the image. They appear to be engaged in various activities. Some are seated on the ground, while others are standing or walking. One person is lying on the ground, possibly injured or deceased. 

2. **Background:**
   - The background of the image is dominated by a landscape. There is a mountain range visible in the distance, suggesting a mountainous or hilly terrain. The sky is not clearly visible, but it appears to be overcast or cloudy.

3. **Foreground:**
   - At the bottom of the image, there is a person lying on the ground. This individual appears to be"
Q79891243,http://www.wikidata.org/entity/Q79891243,Q79891243.jpg,,Bullfights:  A Picador is Unhorsed and Falls Under the Bull,,Bullfights:  A Picador is Unhorsed and Falls Under the Bull,,"The image is a black-and-white drawing or painting that appears to depict a scene involving a horse and a person. The horse is lying on the ground, with its front legs extended forward and its back legs tucked underneath it. The horse's head is turned to the left, and it appears to be in a relaxed state. The person on the horse is dressed in traditional attire, including a hat, long coat, and boots. The person's face is not clearly visible, but they seem to be looking down at the horse.

In the background, there is a structure that resembles a fence or a wall. This structure is partially obscured by the horse and the person, making it difficult to discern its exact details. The ground on which the horse and the person are lying appears to be covered in dirt or grass, suggesting that the scene might be taking place outdoors.

The drawing is finely detailed, and the artist has used shading to create depth and dimension in the image."
Q80447783,http://www.wikidata.org/entity/Q80447783,Q80447783.jpg,1816,Portrait of Prince Aloys Wenzel von Kaunitz-Rietberg,El príncipe Aloys Wenzel von Kaunitz-Rietberg,Portrait of prince Aloys Wenzel von Kaunitz-Rietberg,,"The image depicts a portrait of a man who appears to be of noble or high-ranking status. He is dressed in formal attire, which includes a black coat with gold embroidery, a white shirt, and a white cravat. His hair is styled in a wavy manner, and he has a neatly trimmed beard and mustache. The background of the image is plain and dark, which helps to focus attention on the subject of the portrait.

The man's expression is calm and composed, with a slight smile on his face. His gaze is directed towards the viewer, and he seems to be looking directly at the viewer. The overall composition of the image is balanced, with the man's head and shoulders occupying the majority of the frame.

There are no other objects or figures present in the image, which helps to keep the focus solely on the subject. The absence of distractions allows the viewer to appreciate the details of the man's attire and facial expression.

Given the"
Q83284655,http://www.wikidata.org/entity/Q83284655,Q83284655.jpg,1783,,,Portrait of Camilo Goya,,"The image depicts a portrait of a man who appears to be in his late 30s or early 40s. He is dressed in a black, long-sleeved shirt with a high collar. The man has short, light brown hair that is neatly combed to the side. His facial expression is neutral, and he is looking directly at the viewer. The background of the image is dark, possibly brown or black, which provides a contrast to the lighter tones of the man's clothing and hair.

The man is positioned slightly to the right of the center of the image, and he is looking directly at the viewer. His right hand is slightly raised, and his left hand is resting on his hip. The overall composition of the image suggests a formal or semi-formal setting, possibly a church or an official portrait.

There are no other objects, people, or text present in the image, which helps to keep the focus on the man and his attire"
Q83808748,http://www.wikidata.org/entity/Q83808748,Q83808748.jpg,1812,,,"Portrait of Mariano Goya, the Artist's Grandson",,"The painting depicts a young boy dressed in a black dress with a white collar. He is wearing a black hat with a black band and a white feather sticking out from the band. The boy has a serious expression on his face and is holding a quill pen in his right hand. In the background, there is an open book with text written in a foreign language. To the right of the boy, there is a wooden box with a lid. The background appears to be a dark, neutral color, possibly brown or gray.

### Analysis and Description:

1. **Subject**: The primary subject of the image is a young boy dressed in a black dress with a white collar. He is holding a quill pen in his right hand.
   
2. **Attire**: The boy is wearing a black dress with a white collar. The dress is loose-fitting and has a high neckline.
   
3. **Hat**: The boy is wearing a black hat with"
Q84045740,http://www.wikidata.org/entity/Q84045740,Q84045740.jpg,1827,,,"Portrait of Mariano Goya, the Artist’s Grandson",,"The painting depicts a young man with wavy brown hair. He is wearing a black coat over a white shirt with a high collar. The man has a serious expression on his face and is looking directly at the viewer. The background of the painting is plain and dark, which helps to focus the viewer's attention on the subject. There are no other objects, people, or text present in the image."
